tickers,name,financial_instrument,sector,industry,country,description
BAC,Bank of America Corporation,EQUITY,Financial Services,Banks - Diversified,United States,"Bank of America Corporation, through its subsidiaries, provides various financial products and services for individual consumers, small and middle-market businesses, institutional investors, large corporations, and governments worldwide. The company operates through four segments: Consumer Banking, Global Wealth & Investment Management (GWIM), Global Banking, and Global Markets. The Consumer Banking segment offers traditional and money market savings accounts, certificates of deposit and IRAs, checking accounts, and investment accounts and products; credit and debit cards; residential mortgages and home equity loans; and direct and indirect loans, such as automotive, recreational vehicle, and consumer personal loans. The GWIM segment provides investment management, brokerage, banking, and trust and retirement products and services; wealth management solutions; and customized solutions, including specialty asset management services. The Global Banking segment offers lending products and services, including commercial loans, leases, commitment facilities, trade finance, and commercial real estate and asset-based lending; treasury solutions, such as treasury management, foreign exchange, short-term investing options, and merchant services; working capital management solutions; debt and equity underwriting and distribution, and merger-related and other advisory services; and fixed-income and equity research services. The Global Markets segment provides market-making, financing, securities clearing, settlement, and custody services; securities and derivative products; and risk management products using interest rate, equity, credit, currency and commodity derivatives, foreign exchange, fixed-income, and mortgage-related products. Bank of America Corporation was founded in 1784 and is based in Charlotte, North Carolina."
USB,U.S. Bancorp,EQUITY,Financial Services,Banks - Regional,United States,"U.S. Bancorp, a financial services holding company, provides various financial services to individuals, businesses, institutional organizations, governmental entities, and other financial institutions in the United States. The company operates through Wealth, Corporate, Commercial and Institutional Banking; Consumer and Business Banking; Payment Services; and Treasury and Corporate Support segments. It offers depository services, including checking accounts, savings accounts, and time certificate contracts; and lending services, such as traditional credit products and credit card services, lease financing and import/export trade, asset-backed lending, agricultural finance, and other products. The company also provides cash management, capital markets, and trust and investment management services; and ancillary services comprising capital markets, treasury management, and receivable lock-box collection services to corporate and governmental entity customers. In addition, it offers asset management and fiduciary services for individuals, estates, foundations, business corporations, and charitable organizations; and investment and insurance products to its customers principally within its domestic markets, as well as fund administration services to mutual and other funds. Further, the company provides corporate and purchasing card, and corporate trust services; and credit card services, merchant and ATM processing, mortgage banking, insurance, brokerage and leasing services. U.S. Bancorp was founded in 1863 and is headquartered in Minneapolis, Minnesota."
GERN,Geron Corporation,EQUITY,Healthcare,Biotechnology,United States,"Geron Corporation, a commercial-stage biopharmaceutical company, focuses on the development of therapeutics products for oncology. It offers RYTELO a telomerase inhibitor for the treatment f adult patients with low- to intermediate-1 risk myelodysplastic syndromes with transfusion-dependent anemia. The company was incorporated in 1990 and is headquartered in Foster City, California."
MRK,"Merck & Co., Inc.",EQUITY,Healthcare,Drug Manufacturers - General,United States,"Merck & Co., Inc. operates as a healthcare company worldwide. It operates through two segments, Pharmaceutical and Animal Health. The company offers human health pharmaceutical for various areas, including oncology, vaccines, hospital acute care, cardiovascular, virology, neuroscience, and diabetes under the Keytruda, Welireg, Gardasil, ProQuad, M-M-R II, Varivax, Vaxneuvance, RotaTeq, Pneumovax 23, Bridion, Dificid, Zerbaxa, Noxafil, Winrevair, Adempas, Verquvo, Lagevrio, Isentress/Isentress HD, Delstrigo, Pifeltro, Belsomra, Januvia, and Janumet brands. It also provides veterinary pharmaceuticals, vaccines and health management solutions and services, such as livestock products under the Nuflor, Bovilis/Vista, Bovilis Cryptium, Banamine, Estrumate, Matrix, Resflor, Zuprevo, Revalor, Safe-Guard, M+Pac, Porcilis, Circumvent, Nobilis/Innovax, Paracox and Coccivac, Exzolt, Slice, Imvixa, Clynav, Aquavac/Norvax, Aquaflor, Flexolt brands; Allflex Livestock Intelligence solutions for animal identification, monitoring and traceability; and companion animal products under the Bravecto One-Month, Bravecto Injectable/Quantum, Bravecto Plus, Sentinel Spectrum, Sentinel Flavor Tabs, Optimmune, Nobivac NXT, GilvetMab, Otomax, Mometamax, Mometamax Ultra, Posatex, Caninsulin/Vetsulin, Panacur, Regumate, Prestige, Scalibor/Exspot, Sure Petcare, and Home Again brands. The company has development and commercialization agreement for three of Daiichi Sankyo's deruxtecan ADC candidates; AstraZeneca PLC to co-development and co-commercialize AstraZeneca's Lynparza products for multiple cancer types, and Koselugo for multiple indications; licensed to develop, manufacture and commercialize LM-299, a novel investigational PD-1/VEGF bispecific antibody from LaNova; and collaboration agreement with Eisai Co., Ltd., Bayer AG, and Ridgeback Biotherapeutics LP, as well Moderna, Inc. It has a collaboration agreement with Antengene Corporation Limited to evaluate the combination of ATG-022, a CLDN18.2-targeting antibody-drug conjugate, and anti-PD-1 therapy, as well as KEYTRUDA (pembrolizumab) in patients with advanced solid tumors. Merck & Co., Inc. was founded in 1891 and is headquartered in Rahway, New Jersey."
NBIX,"Neurocrine Biosciences, Inc.",EQUITY,Healthcare,Drug Manufacturers - Specialty & Generic,United States,"Neurocrine Biosciences, Inc. discovers, develops, and markets pharmaceuticals for neurological, neuroendocrine, and neuropsychiatric disorders in the United States and internationally. The company's products include INGREZZA for tardive dyskinesia and chorea associated with Huntington's disease; ALKINDI for adrenal insufficiency; Efmody capsules for classic congenital adrenal hyperplasia; Orilissa tablets for endometriosis; Oriahnn capsules to treat uterine fibroids; and CRENESSITY to treat congenital adrenal hyperplasia. Its product candidates in clinical development include valbenazine to treat dyskinetic cerebral palsy and schizophrenia; NBI-1076986 to treat movement disorders; Osavampator for inadequate response to treatment in major depressive disorder; NBI-1117568 for the treatment of schizophrenia; NBI-1070770 to treat major depressive disorder; and NBI-1117570, NBI-1117567, NBI-1117569, and NBI-1065890 for neuropsychiatric and neurological conditions. The company also has license and collaboration agreements with Nxera Pharma UK Limited; Takeda Pharmaceutical Company Limited; Xenon Pharmaceuticals Inc.; Voyager Therapeutics, Inc.; Mitsubishi Tanabe Pharma Corporation; and AbbVie Inc. The company was incorporated in 1992 and is headquartered in San Diego, California."
PEP,"PepsiCo, Inc.",EQUITY,Consumer Defensive,Beverages - Non-Alcoholic,United States,"PepsiCo, Inc. engages in the manufacture, marketing, distribution, and sale of various beverages and convenient foods worldwide. The company operates through seven segments: Frito-Lay North America; Quaker Foods North America; PepsiCo Beverages North America; Latin America; Europe; Africa, Middle East and South Asia; and Asia Pacific, Australia and New Zealand and China Region. It provides dips, cheese-flavored snacks, and spreads, as well as corn, potato, and tortilla chips; cereals, rice, pasta, mixes and syrups, granola bars, grits, oatmeal, rice cakes, and side dishes; beverage concentrates, fountain syrups, and finished goods; ready-to-drink tea, coffee, and juices; dairy products; and sparkling water makers and related products, as well as distributes alcoholic beverages under Hard MTN Dew brand. The company offers its products primarily under the Lay's, Doritos, Fritos, Tostitos, BaiCaoWei, Cheetos, Cap'n Crunch, Life, Pearl Milling Company, Gatorade, Pepsi-Cola, Mountain Dew, Quaker, Rice-A-Roni, Aquafina, Bubly, Emperador, Diet Mountain Dew, Diet Pepsi, Gatorade Zero, Crush, Propel, Dr Pepper, Schweppes, Marias Gamesa, Ruffles, Sabritas, Saladitas, Tostitos, 7UP, Diet 7UP, H2oh!, Manzanita Sol, Mirinda, Pepsi Black, Pepsi Max, San Carlos, Toddy, Walkers, Chipsy, Kurkure, Sasko, Spekko, White Star, Smith's, Sting, SodaStream, Lubimyj Sad, Agusha, Chudo, Domik v Derevne, Lipton, and other brands. It serves wholesale and other distributors, foodservice customers, grocery stores, drug stores, convenience stores, discount/dollar stores, mass merchandisers, membership stores, hard discounters, e-commerce retailers and authorized independent bottlers, and others through a network of direct-store-delivery, customer warehouse, and distributor networks, as well as directly to consumers through e-commerce platforms and retailers. The company was founded in 1898 and is based in Purchase, New York."
KO,The Coca-Cola Company,EQUITY,Consumer Defensive,Beverages - Non-Alcoholic,United States,"The Coca-Cola Company, a beverage company, manufactures and sells various nonalcoholic beverages in the United States and internationally. The company provides sparkling soft drinks and flavors; water, sports, coffee, and tea; juice, value-added dairy, and plant-based beverages; and other beverages. It also offers beverage concentrates and syrups, as well as fountain syrups to fountain retailers comprising restaurants and convenience stores. The company sells its products under the Coca-Cola, Diet Coke/Coca-Cola Light, Coca-Cola Zero Sugar, caffeine free Diet Coke, Cherry Coke, Fanta Orange, Fanta Zero Orange, Fanta Zero Sugar, Fanta Apple, Sprite, Sprite Zero Sugar, Simply Orange, Simply Apple, Simply Grapefruit, Fresca, Schweppes, Thums Up, Aquarius, Ayataka, BODYARMOR, Ciel, Costa, Crystal, Dasani, dogadan, Fuze Tea, Georgia, glacéau smartwater, glacéau vitaminwater, Gold Peak, I LOHAS, Powerade, Topo Chico, Core Power, Del Valle, fairlife, innocent, Maaza, Minute Maid, Minute Maid Pulpy, and Simply brands. It operates through a network of independent bottling partners, distributors, wholesalers, and retailers, as well as through bottling and distribution operators. The company was founded in 1886 and is headquartered in Atlanta, Georgia."
WMT,Walmart Inc.,EQUITY,Consumer Defensive,Discount Stores,United States,"Walmart Inc. engages in the operation of retail and wholesale stores and clubs, eCommerce websites, and mobile applications worldwide. The company operates through three segments: Walmart U.S., Walmart International, and Sam's Club. It operates supercenters, supermarkets, warehouse clubs, cash and carry stores, and discount stores under Walmart and Walmart Neighborhood Market brands; membership-only warehouse clubs; and ecommerce websites, such as walmart.com.mx, walmart.ca, flipkart.com, PhonePe and other sites. The company also offers grocery items, including dry grocery, snacks, dairy, meat, produce, deli and bakery, frozen foods, alcoholic and nonalcoholic beverages, as well as consumables, such as health and beauty aids, pet supplies, household chemicals, paper goods, and baby products; and fuel and other categories. In addition, it is involved in the provision of health and wellness products covering pharmacy, optical and hearing services, over-the-counter drugs, and protein and nutrition products; and home, hardlines, and seasonal items, including home improvement, outdoor living, gardening, furniture, apparel, jewelry, tools and power equipment, housewares, toys, and mattresses. Further, the company offers consumer electronics and accessories, software, video games, office supplies, appliances, and third-party gift cards. Additionally, it operates digital payment platforms; offers financial services and related products, including money transfers, bill payments, money orders, check cashing, prepaid access, co-branded credit cards, installment lending, and earned wage access; and markets lines of merchandise under private and licensed brands. The company was formerly known as Wal-Mart Stores, Inc. and changed its name to Walmart Inc. in February 2018. Walmart Inc. was founded in 1945 and is based in Bentonville, Arkansas."
TGT,Target Corporation,EQUITY,Consumer Defensive,Discount Stores,United States,"Target Corporation operates as a general merchandise retailer in the United States. The company offers apparel for women, men, young adults, kids, toddlers, and babies, as well as jewelry, accessories, and shoes; and beauty products, such as skin and bath care, cosmetics, hair care, oral care, deodorant, and shaving products. It also provides food and beverage products comprising dry and perishable grocery, including snacks, candy, beverages, deli, bakery, meat, produce, and food service; electronics which includes video games and consoles, toys, sporting goods, entertainment, and luggage; bed and bath, home décor, school/office supplies, storage, small appliances, kitchenware, greeting cards, party supplies, furniture, lighting, home improvement, and seasonal merchandise; and household essentials, such as household cleaning, paper products, over-the-counter healthcare, vitamins and supplements, baby gear, and pet supplies. In addition, the company sells merchandise through periodic design and creative partnerships, and shop-in-shop experience; and in-store amenities. It sells its products through its stores; and digital channels, including Target.com. Target Corporation was incorporated in 1902 and is headquartered in Minneapolis, Minnesota."
DLTR,"Dollar Tree, Inc.",EQUITY,Consumer Defensive,Discount Stores,United States,"Dollar Tree, Inc. operates retail discount stores under the Dollar Tree and Dollar Tree Canada brands in the United States and Canada. The company offers consumable merchandise comprising everyday consumables, such as household paper and chemicals, food, candy, health, personal care products, and frozen and refrigerated food; variety merchandise consisting of toys, durable housewares, gifts, stationery, party goods, greeting cards, softlines, arts and crafts supplies, and other items; and seasonal goods, including Christmas, Easter, Halloween, and Valentine's Day merchandise. Dollar Tree, Inc. was founded in 1986 and is based in Chesapeake, Virginia."
DG,Dollar General Corporation,EQUITY,Consumer Defensive,Discount Stores,United States,"Dollar General Corporation, a discount retailer, provides various merchandise products in the southern, southwestern, midwestern, and eastern United States. The company offers consumable products, including paper towels, bath tissues, paper dinnerware, trash and storage bags, disinfectants, and laundry products; packaged food, such as cereals, pasta, canned soups, canned meats, fruits and vegetables, condiments, spices, sugar, and flour; and perishables, including milk, eggs, bread, refrigerated and frozen food, beer, wine, and produce; candy, cookies, crackers, salty snacks, and carbonated beverages; over-the-counter medicines and personal care products including soap, body wash, shampoo, cosmetics, dental hygiene and foot care products; pet supplies and pet food; and tobacco products. It also provides seasonal products comprising holiday items, toys, batteries, small electronics, greeting cards, stationery, prepaid phones and accessories, gardening supplies, hardware, automotive, and home office supplies; home products include kitchen supplies, cookware, small appliances, light bulbs, storage containers, frames, candles, craft supplies and kitchen, and bed and bath soft goods; and apparel products for infants, toddlers, girls, boys, women and men, as well as socks, underwear, disposable diapers, shoes and accessories. The company was formerly known as J.L. Turner & Son, Inc. and changed its name to Dollar General Corporation in 1968. Dollar General Corporation was founded in 1939 and is based in Goodlettsville, Tennessee."
CBRE,"CBRE Group, Inc.",EQUITY,Real Estate,Real Estate Services,United States,"CBRE Group, Inc. operates as a commercial real estate services and investment company in the United States, the United Kingdom, and internationally. The Advisory Services segment offers strategic advice and execution to owners, investors, and occupiers of real estate in connection with leasing of offices, and industrial and retail space; clients fully integrated property sales services under the CBRE Capital Markets brand; clients commercial mortgage and structured financing services; originates and sells commercial mortgage loans; property management services, such as marketing, building engineering, accounting, and financial services on a contractual basis for owners of and investors in office, industrial, and retail properties; and valuation services that include market value appraisals, litigation support, discounted cash flow analyses, and feasibility studies, as well as consulting services, such as property condition reports, hotel advisory, and environmental consulting. The Global Workplace Solutions segment provides facilities management, including day-to-day management of client-occupied space, headquarters, regional offices, administrative offices, data centers and other critical facilities, manufacturing and laboratory facilities, and distribution facilities and retail space; and project management services comprising building consulting, program, and project and cost management services under the Turner & Townsend brand name. The Real Estate Investments segment offers investment management services under the CBRE Investment Management brand to pension funds, insurance companies, sovereign wealth funds, foundations, endowments, and other institutional investors; and development services, such as real estate development and investment activities under the Trammell Crow Company and Telford Homes brands to users and investors in commercial real estate, and for their own account. CBRE Group, Inc. was founded in 1906 and is headquartered in Dallas, Texas."
AVB,"AvalonBay Communities, Inc.",EQUITY,Real Estate,REIT - Residential,United States,"AvalonBay Communities, Inc., a member of the S&P 500, is an equity REIT that develops, redevelops, acquires and manages apartment communities in leading metropolitan areas in New England, the New York/New Jersey Metro area, the Mid-Atlantic, the Pacific Northwest, and Northern and Southern California, as well as in the Company's expansion regions of Raleigh-Durham and Charlotte, North Carolina, Southeast Florida, Dallas and Austin, Texas, and Denver, Colorado. As of December 31, 2024, the Company owned or held a direct or indirect ownership interest in 306 apartment communities containing 93,518 apartment homes in 12 states and the District of Columbia, of which 17 communities were under development."
DLR,"Digital Realty Trust, Inc.",EQUITY,Real Estate,REIT - Specialty,United States,"Digital Realty Trust, Inc. (Digital Realty or the company) owns, acquires, develops, and operates data centers through its operating partnership subsidiary, Digital Realty Trust, L.P. (the operating partnership). The company is focused on providing data center, colocation, and interconnection solutions for domestic and international customers across a variety of industry verticals ranging from cloud and information technology services, communications and social networking to financial services, manufacturing, energy, healthcare, and consumer products. As of March 31, 2025, the company's 308 data centers, including 78 data centers held as investments in unconsolidated joint ventures, contain applications and operations critical to the day-to-day operations of technology industry and corporate enterprise data center customers. Digital Realty's portfolio is comprised of approximately 41.8 million square feet, excluding approximately 9.5 million square feet of space under active development and 5.1 million square feet of space held for future development, located throughout North America, Europe, South America, Asia, Australia, and Africa."
MTDR,Matador Resources Company,EQUITY,Energy,Oil & Gas E&P,United States,"Matador Resources Company, an independent energy company, engages in the acquisition, exploration, development, and production of oil and natural gas resources in the United States. It operates through two segments, Exploration and Production; and Midstream. The company primarily holds interests in the Wolfcamp and Bone Spring plays in the Delaware Basin in Southeast New Mexico and West Texas. It also operates the Eagle Ford shale play in South Texas; and the Haynesville shale and Cotton Valley plays in Northwest Louisiana. In addition, the company conducts midstream operations in support of its exploration, development, and production operations. Further, it provides natural gas processing and oil transportation services; and oil, natural gas, and produced water gathering services, as well as produced water disposal services to third parties. The company sells natural gas to unaffiliated independent marketing companies and unaffiliated midstream companies. The company was formerly known as Matador Holdco, Inc. and changed its name to Matador Resources Company in August 2011. Matador Resources Company was incorporated in 2003 and is headquartered in Dallas, Texas."
TSM,Taiwan Semiconductor Manufacturing Company Limited,EQUITY,Technology,Semiconductors,Taiwan,"Taiwan Semiconductor Manufacturing Company Limited, together with its subsidiaries, manufactures, packages, tests, and sells integrated circuits and other semiconductor devices in Taiwan, China, Europe, the Middle East, Africa, Japan, the United States, and internationally. It provides various wafer fabrication processes, such as processes to manufacture complementary metal- oxide-semiconductor (CMOS) logic, mixed-signal, radio frequency, embedded memory, bipolar CMOS mixed-signal, and others. The company also involved in providing customer and engineering support services; manufacturing of masks; investment in technology start-up companies; research, designing, developing, manufacturing, packaging, testing, and sale of color filters; and investment activities. Its products are used in high performance computing, smartphones, Internet of things, automotive, and digital consumer electronics. The company was incorporated in 1987 and is headquartered in Hsinchu City, Taiwan."
WFRD,Weatherford International plc,EQUITY,Energy,Oil & Gas Equipment & Services,United States,"Weatherford International plc, an energy services company, provides equipment and services for the drilling, evaluation, completion, production, and intervention of oil, geothermal, and natural gas wells worldwide. The company operates through three segments: Drilling and Evaluation; Well Construction and Completions; and Production and Intervention. It offers managed pressure drilling; directional drilling services, and logging and measurement services while drilling; services related to rotary-steerable systems, high temperature and high pressure sensors, drilling reamers, and circulation subs; open-hole and cased-hole logging services; drilling fluids; and intervention and remediation services. The company also provides tubular handling, management, and connection services; cementing products, including plugs, float and stage equipment, and torque-and-drag reduction technology for zonal isolation; completion tools, such as safety valves, production packers, downhole reservoir monitoring, flow control, isolation packers, multistage fracturing systems and sand-control technologies; liner hangers to suspend a casing string in high-temperature and high-pressure wells; and well Services. In addition, it offers re-entry, fishing, and well abandonment services, as well as patented bottom hole, tubular-handling equipment, pressure-control equipment, and drill pipe and tubulars; artificial lift systems, including reciprocating rod, progressing cavity pumping, and related automation and control systems, as well as gas, hydraulic, plunger, and hybrid lift systems; and software, automation and flow measurement solutions. Further, it provides electrical and hydraulic power transmission to subsea equipment; and pressure pumping and reservoir stimulation services, such as acidizing, fracturing, cementing, and coiled-tubing intervention. The company was incorporated in 1972 and is based in Houston, Texas."
