tickers,name,financial_instrument,sector,industry,country,description
BMA,Banco Macro S.A.,EQUITY,Financial Services,Banks - Regional,Argentina,"Banco Macro S.A. provides various banking products and services to retail and corporate customers in Argentina. It offers various retail banking products and services, such as savings and checking accounts, time deposits, credit and debit cards, consumer finance loans, mortgage loans, automobile loans, overdrafts, credit-related services, home and car insurance coverage, tax collection, utility payments, automated teller machines, and money transfers. The company also provides personal loans, document discounts, residential mortgages, overdrafts, pledged loans, and credit card loans to retail customers. In addition, it offers corporate banking products and services, including deposits, lending, check cashing advances and factoring, guaranteed loans, credit lines for financing foreign trade, and cash management services; and trust, payroll, and financial agency services, as well as corporate credit cards and other specialty products; and working capital facilities, credit for investment projects, and leasing and foreign trade transactions. Further, the company provides transaction services, such as cash management, collection services, payments to suppliers, payroll services, foreign exchange transactions, and foreign trade services; information services comprising Datanet and Interpymes services to corporate customers; and Internet and mobile banking services. Additionally, it offers short-term and medium-to-long-term corporate lending products. Banco Macro S.A. was incorporated in 1966 and is headquartered in Buenos Aires, Argentina."
MU,"Micron Technology, Inc.",EQUITY,Technology,Semiconductors,United States,"Micron Technology, Inc. designs, develops, manufactures, and sells memory and storage products in the United States, Taiwan, Mainland China, rest of the Asia Pacific, Hong Kong, Japan, Europe, and internationally. The company operates through four segments: Compute and Networking Business Unit, Mobile Business Unit, Embedded Business Unit, and Storage Business Unit. It provides memory and storage technologies comprising dynamic random access memory semiconductor devices with low latency that provide high-speed data retrieval; non-volatile and re-writeable semiconductor storage devices; and non-volatile re-writable semiconductor memory devices that provide fast read speeds under the Micron and Crucial brands, as well as through private labels. The company offers serves the data center, PC, graphics, networking, automotive, industrial, and consumer embedded markets, as well as for smartphone and other mobile-device markets. It markets its products through its direct sales force, independent sales representatives, distributors, and retailers; and web-based customer direct sales channel, as well as through channel and distribution partners. Micron Technology, Inc. was founded in 1978 and is headquartered in Boise, Idaho."
CIVI,"Civitas Resources, Inc.",EQUITY,Energy,Oil & Gas E&P,United States,"Civitas Resources, Inc., an exploration and production company, focuses on the acquisition, development, and production of crude oil and associated liquids-rich natural gas. Its assets include DJ Basin assets comprising of approximately 356,800 net acres located in Weld, Arapahoe, Adams, and Boulder counties, Colorado; and Permian Basin assets comprising of 120,400 net acres located in Upton, Reagan, Glasscock, Martin, Midland, Reeves, and Loving counties, Texas, and Eddy and Lea counties, New Mexico. The company was formerly known as Bonanza Creek Energy, Inc. Civitas Resources, Inc. was incorporated in 2010 and is based in Denver, Colorado."
SYF,Synchrony Financial,EQUITY,Financial Services,Credit Services,United States,"Synchrony Financial, together with its subsidiaries, operates as a consumer financial services company in the United States. It provides credit products, such as credit cards, commercial credit products, and consumer installment loans. The company also offers private label credit cards, dual and general purpose co-branded cards, short- and long-term installment loans, and consumer banking products; and deposit products, including certificates of deposit, individual retirement accounts, money market accounts, savings accounts, and sweep and affinity deposits, as well as accepts deposits through third-party securities brokerage firms. In addition, it provides debt cancellation products to its credit card customers through online and mobile channels; and healthcare payments and financing solutions under the CareCredit and Walgreens brands; payments and financing solutions in the apparel, specialty retail, outdoor, music, and luxury industries, such as American Eagle, Dick's Sporting Goods, Guitar Center, Kawasaki, Pandora, Polaris, Suzuki, and Sweetwater. The company offers its credit products through programs established with a group of national and regional retailers, local merchants, manufacturers, buying groups, industry associations, and healthcare service providers; and deposit products through various channels, such as digital and print. It serves digital, health and wellness, retail, home, auto, telecommunications, pet, outdoor, and other industries. The company was founded in 1932 and is headquartered in Stamford, Connecticut."
MTRX,Matrix Service Company,EQUITY,Industrials,Engineering & Construction,United States,"Matrix Service Company provides engineering, fabrication, construction, and maintenance services to support critical energy infrastructure and industrial markets in the United States, Canada, and internationally. The company's Storage and Terminal Solutions segment undertakes work related to aboveground crude oil and refined product storage tanks and terminals; engineering, procurement, fabrication, and construction services related to cryogenic, specialty tanks, and terminals for LNG, NGLs, hydrogen, ammonia, propane, butane, liquid nitrogen/liquid oxygen, and liquid petroleum; and provides plant work, truck and rail loading/offloading facilities, and marine structures, as well as storage tank and terminal maintenance and repair. This segment offers engineered specialty tank products, including geodesic domes, aluminum internal floating roofs, floating suction and skimmer systems, roof drain systems, and floating roof seals. Its Utility and Power Infrastructure segment offers power delivery services, including construction of new substations, upgrades of existing substations, transmission and distribution line installations, and upgrades and maintenance, and emergency and storm restoration services. This segment provides engineering, fabrication, and construction services for LNG utility peak shaving facilities; and construction and maintenance services to power generation facilities, including natural gas fired facilities. The company's Process and Industrial Facilities segment offers plant maintenance and turnarounds for refining and processing of crude oil, fractionating, and marketing of natural gas and natural gas liquids; engineering, procurement, fabrication, and construction for refinery upgrades and retrofits for hydrogen processing, production, loading, and distribution facilities; and constructs thermal vacuum test chambers for aerospace and defense, and other industries. The company was founded in 1984 and is headquartered in Tulsa, Oklahoma."
JKS,"JinkoSolar Holding Co., Ltd.",EQUITY,Technology,Solar,China,"JinkoSolar Holding Co., Ltd., together with its subsidiaries, engages in the design, development, production, and marketing of photovoltaic products. The company offers solar modules, silicon wafers, solar cells, recovered silicon materials, and silicon ingots. It provides solar system integration services; solar power generation and solar system EPC services; and energy storage system, as well as undertakes solar power projects. The company sells its products to distributors, project developers, system integrators, and manufacturers of solar power products under the JinkoSolar brand. As of December 31, 2024, it had an integrated annual capacity of 120 gigawatts (GW) for mono wafers; 95 GW for solar cells; and 130 GW for solar modules. It operates in China, the United States, Mexico, Australia, Japan, the United Arab Emirates, Turkey, Jordan, Vietnam, Egypt, Spain, Germany, and internationally. The company was founded in 2006 and is headquartered in Shangrao, the People's Republic of China."
ARM,Arm Holdings plc,EQUITY,Technology,Semiconductors,United Kingdom,"Arm Holdings plc architects, develops, and licenses central processing unit products and related technologies for semiconductor companies and original equipment manufacturers. The company is involved in the licensing, marketing, research, and development of microprocessors, systems intellectual property (IPs), graphics processing units, physical IP and associated systems IPs, software, tools, and other related services. It also offers arm central processing units, accelerators, system IP products, and compute platform products, as well as development tools and software. The company's products are used in various markets, such as automotive, computing infrastructure, consumer technologies, and Internet of things. It operates in the United States, the People's Republic of China, Taiwan, the Republic of Korea, and internationally. The company was founded in 1990 and is headquartered in Cambridge, the United Kingdom. Arm Holdings plc is a subsidiary of SoftBank Group Corp."
AVGO,Broadcom Inc.,EQUITY,Technology,Semiconductors,United States,"Broadcom Inc. designs, develops, and supplies various semiconductor devices with a focus on complex digital and mixed signal complementary metal oxide semiconductor based devices and analog III-V based products worldwide. The company operates in two segments, Semiconductor Solutions and Infrastructure Software. It provides Ethernet switching and routing custom silicon solutions, optical and copper physical layer devices, and fiber optic transmitter and receiver components; set-top box system-on-chips (SoCs), data over cable service interface specifications cable modem and networking infrastructure, DSL access multiplexer/PON optical line termination products, and Wi-Fi access point SoCs, as well as digital subscriber line (DSL)/cable, passive optical networking (PON) gateways; and fiber optic components and mobile device connectivity solutions. The company also offers RF front end modules and filters; Wi-Fi, Bluetooth, and global positioning system/global navigation satellite system SoCs; custom touch controllers; inductive charging application specific integrated circuits; serial attached small computer system interface and redundant array of independent disks controllers and adapters, peripheral component interconnect express switches, fiber channel host bus adapters, read channel based SoCs, custom flash controllers, and preamplifiers; and optocouplers, industrial fiber optics, industrial and medical sensors, motion control encoders and subsystems, light emitting diodes, ethernet PHYs, switch ICs, and camera microcontrollers. Its products are used in various applications in enterprise and data center networking, including artificial intelligence networking and connectivity, home connectivity, set-top boxes, broadband access, telecommunication equipment, smartphones and base stations, data center servers and storage systems, factory automation, power generation and alternative energy systems, and electronic displays. Broadcom Inc. was founded in 1961 and is headquartered in Palo Alto, California."
CRDO,Credo Technology Group Holding Ltd,EQUITY,Technology,Semiconductors,Cayman Islands,"Credo Technology Group Holding Ltd provides various high-speed connectivity Credo Technology Group Holding Ltd provides various high-speed connectivity solutions for optical and electrical Ethernet applications in the United States, Taiwan, Mainland China, Hong Kong, and internationally. Its products include HiWire active electrical cables, optical digital signal processors, low-power line card PHY, serializer/deserializer (SerDes) chiplets, and SerDes IP, as well as integrated circuits, active electrical cables. The company also offers intellectual property solutions consist of SerDes IP licensing. It sells its products to hyperscalers, original equipment manufacturers, original design manufacturers and optical module manufacturers, as well as into the enterprise and HPC markets. The company was founded in 2008 and is based in Grand Cayman, Cayman Islands."
KHC,The Kraft Heinz Company,EQUITY,Consumer Defensive,Packaged Foods,United States,"The Kraft Heinz Company, together with its subsidiaries, manufactures and markets food and beverage products in North America and internationally. Its products include condiments and sauces, cheese and dairy products, meals, meats, refreshment beverages, coffee, and other grocery products under the Kraft, Oscar Mayer, Heinz, Philadelphia, Lunchables, Velveeta, Ore-Ida, Maxwell House, Kool-Aid, Jell-O, Heinz, ABC, Master, Quero, Kraft, Golden Circle, Wattie's, Pudliszki, and Plasmon brands. It sells its products through its own sales organizations, as well as through independent brokers, agents, and distributors to chain, wholesale, cooperative, and independent grocery accounts; convenience, value, and club stores; pharmacies and drug stores; mass merchants; foodservice distributors; institutions, including hotels, restaurants, bakeries, hospitals, health care facilities, and government agencies; and c various e-commerce platforms and retailers. The company was formerly known as H.J. Heinz Holding Corporation and changed its name to The Kraft Heinz Company in July 2015. The company was founded in 1869 and is based in Pittsburgh, Pennsylvania."
AAPL,Apple Inc.,EQUITY,Technology,Consumer Electronics,United States,"Apple Inc. designs, manufactures, and markets smartphones, personal computers, tablets, wearables, and accessories worldwide. The company offers iPhone, a line of smartphones; Mac, a line of personal computers; iPad, a line of multi-purpose tablets; and wearables, home, and accessories comprising AirPods, Apple TV, Apple Watch, Beats products, and HomePod. It also provides AppleCare support and cloud services; and operates various platforms, including the App Store that allow customers to discover and download applications and digital content, such as books, music, video, games, and podcasts, as well as advertising services include third-party licensing arrangements and its own advertising platforms. In addition, the company offers various subscription-based services, such as Apple Arcade, a game subscription service; Apple Fitness+, a personalized fitness service; Apple Music, which offers users a curated listening experience with on-demand radio stations; Apple News+, a subscription news and magazine service; Apple TV+, which offers exclusive original content; Apple Card, a co-branded credit card; and Apple Pay, a cashless payment service, as well as licenses its intellectual property. The company serves consumers, and small and mid-sized businesses; and the education, enterprise, and government markets. It distributes third-party applications for its products through the App Store. The company also sells its products through its retail and online stores, and direct sales force; and third-party cellular network carriers, wholesalers, retailers, and resellers. Apple Inc. was founded in 1976 and is headquartered in Cupertino, California."
META,"Meta Platforms, Inc.",EQUITY,Communication Services,Internet Content & Information,United States,"Meta Platforms, Inc. engages in the development of products that enable people to connect and share with friends and family through mobile devices, personal computers, virtual reality and mixed reality headsets, augmented reality, and wearables worldwide. It operates through two segments, Family of Apps (FoA) and Reality Labs (RL). The FoA segment offers Facebook, which enables people to build community through feed, reels, stories, groups, marketplace, and other; Instagram that brings people closer through instagram feed, stories, reels, live, and messaging; Messenger, a messaging application for people to connect with friends, family, communities, and businesses across platforms and devices through text, audio, and video calls; Threads, an application for text-based updates and public conversations; and WhatsApp, a messaging application that is used by people and businesses to communicate and transact in a private way. The RL segment provides virtual, augmented, and mixed reality related products comprising consumer hardware, software, and content that help people feel connected, anytime, and anywhere. The company was formerly known as Facebook, Inc. and changed its name to Meta Platforms, Inc. in October 2021. The company was incorporated in 2004 and is headquartered in Menlo Park, California."
NVDA,NVIDIA Corporation,EQUITY,Technology,Semiconductors,United States,"NVIDIA Corporation, a computing infrastructure company, provides graphics and compute and networking solutions in the United States, Singapore, Taiwan, China, Hong Kong, and internationally. The Compute & Networking segment comprises Data Center computing platforms and end-to-end networking platforms, including Quantum for InfiniBand and Spectrum for Ethernet; NVIDIA DRIVE automated-driving platform and automotive development agreements; Jetson robotics and other embedded platforms; NVIDIA AI Enterprise and other software; and DGX Cloud software and services. The Graphics segment offers GeForce GPUs for gaming and PCs, the GeForce NOW game streaming service and related infrastructure, and solutions for gaming platforms; Quadro/NVIDIA RTX GPUs for enterprise workstation graphics; virtual GPU or vGPU software for cloud-based visual and virtual computing; automotive platforms for infotainment systems; and Omniverse software for building and operating industrial AI and digital twin applications. It also customized agentic solutions designed in collaboration with NVIDIA to accelerate enterprise AI adoption. The company's products are used in gaming, professional visualization, data center, and automotive markets. It sells its products to original equipment manufacturers, original device manufacturers, system integrators and distributors, independent software vendors, cloud service providers, consumer internet companies, add-in board manufacturers, distributors, automotive manufacturers and tier-1 automotive suppliers, and other ecosystem participants. NVIDIA Corporation was incorporated in 1993 and is headquartered in Santa Clara, California."
